{
  "schema_version": "verification-kit.manifest.v0.1",
  "kit_id": "vk_2026_0605_example_001",
  "created_at": "2026-06-05T08:00:00Z",
  "created_by": {
    "organization": "C3 Social Design Center",
    "system": "replay_engine_prototype",
    "operator_role": "research_prototype"
  },
  "scope": {
    "workflow_type": "ai_development_gate_replay",
    "claim_boundary": [
      "auditability",
      "reproducibility",
      "decision_path_traceability"
    ],
    "excluded_claims": [
      "absolute_safety",
      "truth_guarantee",
      "production_certification",
      "complete_alignment"
    ]
  },
  "inputs": {
    "dataset": {
      "name": "example_gate_requests",
      "record_count": 20,
      "sha256": "sha256:REPLACE_WITH_DATASET_HASH"
    },
    "specification": {
      "name": "verification_rate_gap_research_note",
      "version": "v0.1",
      "sha256": "sha256:REPLACE_WITH_SPEC_HASH"
    },
    "policy": {
      "name": "example_release_gate_policy",
      "version": "v0.1",
      "sha256": "sha256:REPLACE_WITH_POLICY_HASH"
    }
  },
  "engine": {
    "name": "replay_engine",
    "version": "v0.1-prototype",
    "deterministic_mode": true,
    "runtime_llm_used": false,
    "sha256": "sha256:REPLACE_WITH_ENGINE_HASH"
  },
  "outputs": {
    "verdicts": {
      "path": "verdicts.jsonl",
      "sha256": "sha256:REPLACE_WITH_VERDICTS_HASH"
    },
    "summary": {
      "path": "summary.json",
      "sha256": "sha256:REPLACE_WITH_SUMMARY_HASH"
    },
    "conformance": {
      "path": "conformance.json",
      "sha256": "REPLACE_WITH_CONFORMANCE_HASH"
    },
    "undefined_report": {
      "path": "undefined_report.json",
      "sha256": "sha256:REPLACE_WITH_UNDEFINED_HASH"
    },
    "evidence_digest": {
      "path": "evidence_digest.json",
      "sha256": "sha256:REPLACE_WITH_EVIDENCE_DIGEST_HASH"
    }
  },
  "verdict_summary": {
    "total_cases": 20,
    "pass": 8,
    "hold": 7,
    "escalate": 3,
    "fail": 0,
    "undefined": 2,
    "non_pass_total": 12
  },
  "verification": {
    "replay_expected": true,
    "same_input_same_spec_same_engine_required": true,
    "cli_reference_verifier": {
      "required": true,
      "command_example": "verify-kit --kit ./verification_kit --strict"
    },
    "byo_ai_audit": {
      "allowed": true,
      "source_of_truth": false,
      "prompt_path": "auditor_prompt.md"
    }
  },
  "integrity": {
    "signed_manifest": true,
    "signature_path": "signature.sig",
    "signature_algorithm": "REPLACE_WITH_SIGNATURE_ALGORITHM",
    "previous_manifest_hash": null
  }
}